{
  "upstream_revision": "2a4d886703753a8893bfa17ade8a554df61f59ab",
  "evidence_delta_schema_sha256": "ab98db6810db12bdf22b04e6b113bbbe4cbe43aa187702967ad1db30c1e0ff16",
  "document_state_schema_sha256": "a9a81cd6b65acf1a256529337c985ad512d34a7b79274f48a926490c35f1aa2b",
  "evidence_delta": {
    "delta_schema": "ferrodoc-evidence-delta/1",
    "source_pdf_sha256": "aaaaaaaaaaaaaaaaaaaaaaaaaaaaaaaaaaaaaaaaaaaaaaaaaaaaaaaaaaaaaaaa",
    "ir_schema": {"major": 1, "minor": 0},
    "stage": "native_extract",
    "producer": {
      "name": "ferrodoc-portable-conformance",
      "version": "1.0.0",
      "build": "bbbbbbbbbbbbbbbbbbbbbbbbbbbbbbbbbbbbbbbbbbbbbbbbbbbbbbbbbbbbbbbb",
      "model_digest": null,
      "configuration_digest": "cccccccccccccccccccccccccccccccccccccccccccccccccccccccccccccccc"
    },
    "scope": {"kind": "document"},
    "input_state_id": null,
    "required_evidence_ids": [],
    "new_pages": [
      {
        "id": "page_2222222222222222222222222222222222222222222222222222222222222222",
        "index": 0,
        "bounds": {"page_index":0,"rect":{"x":0.0,"y":0.0,"width":100.0,"height":100.0,"space":"pdf","unit":"point"},"source_transform":[1.0,0.0,0.0,1.0,0.0,0.0]},
        "layers": [{"id":"layer_1111111111111111111111111111111111111111111111111111111111111111","kind":{"kind":"native_pdf"},"provenance":{"schema_version":{"major":1,"minor":0},"input_digest":"aaaaaaaaaaaaaaaaaaaaaaaaaaaaaaaaaaaaaaaaaaaaaaaaaaaaaaaaaaaaaaaa","engine_id":"portable-fixture","engine_version":"1.0.0","model_digest":null,"parameters":{},"stage":"native_extract"}}],
        "artifacts": [],
        "regions": [
          {
            "id":"region_4444444444444444444444444444444444444444444444444444444444444444","kind":"heading","geometry":{"page_index":0,"rect":{"x":5.0,"y":5.0,"width":70.0,"height":5.0,"space":"pdf","unit":"point"},"source_transform":[1.0,0.0,0.0,1.0,0.0,0.0]},
            "evidence":[{"id":"evidence_1000000000000000000000000000000000000000000000000000000000000000","layer_id":"layer_1111111111111111111111111111111111111111111111111111111111111111","content":{"kind":"text","text":"Portable Semiconductor SYNTH2000"},"geometry":{"page_index":0,"rect":{"x":5.0,"y":5.0,"width":70.0,"height":5.0,"space":"pdf","unit":"point"},"source_transform":[1.0,0.0,0.0,1.0,0.0,0.0]},"geometry_quality":"region","confidence":null,"provenance":{"schema_version":{"major":1,"minor":0},"input_digest":"aaaaaaaaaaaaaaaaaaaaaaaaaaaaaaaaaaaaaaaaaaaaaaaaaaaaaaaaaaaaaaaa","engine_id":"portable-fixture","engine_version":"1.0.0","model_digest":null,"parameters":{},"stage":"native_extract"},"engine_metadata":{}}],
            "selected":{"evidence_ids":["evidence_1000000000000000000000000000000000000000000000000000000000000000"],"reason":"native_quality","explanation":"selected exact source title"}
          },
          {
            "id":"region_5555555555555555555555555555555555555555555555555555555555555555","kind":"heading","geometry":{"page_index":0,"rect":{"x":5.0,"y":15.0,"width":70.0,"height":5.0,"space":"pdf","unit":"point"},"source_transform":[1.0,0.0,0.0,1.0,0.0,0.0]},
            "evidence":[{"id":"evidence_2000000000000000000000000000000000000000000000000000000000000000","layer_id":"layer_1111111111111111111111111111111111111111111111111111111111111111","content":{"kind":"text","text":"Recommended Operating Conditions"},"geometry":{"page_index":0,"rect":{"x":5.0,"y":15.0,"width":70.0,"height":5.0,"space":"pdf","unit":"point"},"source_transform":[1.0,0.0,0.0,1.0,0.0,0.0]},"geometry_quality":"region","confidence":null,"provenance":{"schema_version":{"major":1,"minor":0},"input_digest":"aaaaaaaaaaaaaaaaaaaaaaaaaaaaaaaaaaaaaaaaaaaaaaaaaaaaaaaaaaaaaaaa","engine_id":"portable-fixture","engine_version":"1.0.0","model_digest":null,"parameters":{},"stage":"native_extract"},"engine_metadata":{}}],
            "selected":{"evidence_ids":["evidence_2000000000000000000000000000000000000000000000000000000000000000"],"reason":"native_quality","explanation":"selected exact source heading"}
          },
          {
            "id":"region_6666666666666666666666666666666666666666666666666666666666666666","kind":"table","geometry":{"page_index":0,"rect":{"x":5.0,"y":25.0,"width":90.0,"height":30.0,"space":"pdf","unit":"point"},"source_transform":[1.0,0.0,0.0,1.0,0.0,0.0]},
            "evidence":[
              {"id":"evidence_3000000000000000000000000000000000000000000000000000000000000000","layer_id":"layer_1111111111111111111111111111111111111111111111111111111111111111","content":{"kind":"text","text":"Parameter"},"geometry":null,"geometry_quality":"region","confidence":null,"provenance":{"schema_version":{"major":1,"minor":0},"input_digest":"aaaaaaaaaaaaaaaaaaaaaaaaaaaaaaaaaaaaaaaaaaaaaaaaaaaaaaaaaaaaaaaa","engine_id":"portable-fixture","engine_version":"1.0.0","model_digest":null,"parameters":{},"stage":"native_extract"},"engine_metadata":{}},
              {"id":"evidence_4000000000000000000000000000000000000000000000000000000000000000","layer_id":"layer_1111111111111111111111111111111111111111111111111111111111111111","content":{"kind":"text","text":"Conditions"},"geometry":null,"geometry_quality":"region","confidence":null,"provenance":{"schema_version":{"major":1,"minor":0},"input_digest":"aaaaaaaaaaaaaaaaaaaaaaaaaaaaaaaaaaaaaaaaaaaaaaaaaaaaaaaaaaaaaaaa","engine_id":"portable-fixture","engine_version":"1.0.0","model_digest":null,"parameters":{},"stage":"native_extract"},"engine_metadata":{}},
              {"id":"evidence_5000000000000000000000000000000000000000000000000000000000000000","layer_id":"layer_1111111111111111111111111111111111111111111111111111111111111111","content":{"kind":"text","text":"Min"},"geometry":null,"geometry_quality":"region","confidence":null,"provenance":{"schema_version":{"major":1,"minor":0},"input_digest":"aaaaaaaaaaaaaaaaaaaaaaaaaaaaaaaaaaaaaaaaaaaaaaaaaaaaaaaaaaaaaaaa","engine_id":"portable-fixture","engine_version":"1.0.0","model_digest":null,"parameters":{},"stage":"native_extract"},"engine_metadata":{}},
              {"id":"evidence_6000000000000000000000000000000000000000000000000000000000000000","layer_id":"layer_1111111111111111111111111111111111111111111111111111111111111111","content":{"kind":"text","text":"Typ"},"geometry":null,"geometry_quality":"region","confidence":null,"provenance":{"schema_version":{"major":1,"minor":0},"input_digest":"aaaaaaaaaaaaaaaaaaaaaaaaaaaaaaaaaaaaaaaaaaaaaaaaaaaaaaaaaaaaaaaa","engine_id":"portable-fixture","engine_version":"1.0.0","model_digest":null,"parameters":{},"stage":"native_extract"},"engine_metadata":{}},
              {"id":"evidence_7000000000000000000000000000000000000000000000000000000000000000","layer_id":"layer_1111111111111111111111111111111111111111111111111111111111111111","content":{"kind":"text","text":"Max"},"geometry":null,"geometry_quality":"region","confidence":null,"provenance":{"schema_version":{"major":1,"minor":0},"input_digest":"aaaaaaaaaaaaaaaaaaaaaaaaaaaaaaaaaaaaaaaaaaaaaaaaaaaaaaaaaaaaaaaa","engine_id":"portable-fixture","engine_version":"1.0.0","model_digest":null,"parameters":{},"stage":"native_extract"},"engine_metadata":{}},
              {"id":"evidence_8000000000000000000000000000000000000000000000000000000000000000","layer_id":"layer_1111111111111111111111111111111111111111111111111111111111111111","content":{"kind":"text","text":"Unit"},"geometry":null,"geometry_quality":"region","confidence":null,"provenance":{"schema_version":{"major":1,"minor":0},"input_digest":"aaaaaaaaaaaaaaaaaaaaaaaaaaaaaaaaaaaaaaaaaaaaaaaaaaaaaaaaaaaaaaaa","engine_id":"portable-fixture","engine_version":"1.0.0","model_digest":null,"parameters":{},"stage":"native_extract"},"engine_metadata":{}},
              {"id":"evidence_9000000000000000000000000000000000000000000000000000000000000000","layer_id":"layer_1111111111111111111111111111111111111111111111111111111111111111","content":{"kind":"text","text":"Input voltage"},"geometry":null,"geometry_quality":"region","confidence":null,"provenance":{"schema_version":{"major":1,"minor":0},"input_digest":"aaaaaaaaaaaaaaaaaaaaaaaaaaaaaaaaaaaaaaaaaaaaaaaaaaaaaaaaaaaaaaaa","engine_id":"portable-fixture","engine_version":"1.0.0","model_digest":null,"parameters":{},"stage":"native_extract"},"engine_metadata":{}},
              {"id":"evidence_a000000000000000000000000000000000000000000000000000000000000000","layer_id":"layer_1111111111111111111111111111111111111111111111111111111111111111","content":{"kind":"text","text":"TA = 25 °C [1]"},"geometry":null,"geometry_quality":"region","confidence":null,"provenance":{"schema_version":{"major":1,"minor":0},"input_digest":"aaaaaaaaaaaaaaaaaaaaaaaaaaaaaaaaaaaaaaaaaaaaaaaaaaaaaaaaaaaaaaaa","engine_id":"portable-fixture","engine_version":"1.0.0","model_digest":null,"parameters":{},"stage":"native_extract"},"engine_metadata":{}},
              {"id":"evidence_b000000000000000000000000000000000000000000000000000000000000000","layer_id":"layer_1111111111111111111111111111111111111111111111111111111111111111","content":{"kind":"text","text":"1.8"},"geometry":null,"geometry_quality":"region","confidence":null,"provenance":{"schema_version":{"major":1,"minor":0},"input_digest":"aaaaaaaaaaaaaaaaaaaaaaaaaaaaaaaaaaaaaaaaaaaaaaaaaaaaaaaaaaaaaaaa","engine_id":"portable-fixture","engine_version":"1.0.0","model_digest":null,"parameters":{},"stage":"native_extract"},"engine_metadata":{}},
              {"id":"evidence_c000000000000000000000000000000000000000000000000000000000000000","layer_id":"layer_1111111111111111111111111111111111111111111111111111111111111111","content":{"kind":"text","text":"3.3"},"geometry":null,"geometry_quality":"region","confidence":null,"provenance":{"schema_version":{"major":1,"minor":0},"input_digest":"aaaaaaaaaaaaaaaaaaaaaaaaaaaaaaaaaaaaaaaaaaaaaaaaaaaaaaaaaaaaaaaa","engine_id":"portable-fixture","engine_version":"1.0.0","model_digest":null,"parameters":{},"stage":"native_extract"},"engine_metadata":{}},